{
  "eval_id": "hitl_prisma_fix_001",
  "source": {
    "resource_code": "hitl_prisma_fix_001",
    "origin": "hitl",
    "prompt_versions": {
      "appraisal": "appraisal@1.0.0",
      "classification": "classification@1.0.0",
      "discovery": "discovery@1.0.0",
      "editorial": "editorial@1.0.0",
      "reconciliation": "reconciliation@1.0.0",
      "qc_panel": "qc_panel@1.0.0",
      "arbiter": "arbiter@1.0.0"
    },
    "failure_mode": "wrong methodology leaf"
  },
  "expected_classification": {
    "resource_type_code": "reporting_guideline",
    "resource_subtype_code": "primary_guideline",
    "methodology_codes": [
      "SYN-04"
    ],
    "skill_codes": [
      "FS-02"
    ],
    "stage_codes": [
      "SH-01"
    ],
    "discipline_codes": [],
    "tags": [],
    "domain_codes": [
      "EBM"
    ]
  },
  "conversation": [
    {
      "user_content": {
        "parts": [
          {
            "text": "Curate one reporting_guideline resource titled \"PRISMA 2020\". URL: https://doi.org/10.1136/bmj.n71. Focus methodologies: SYN-04.",
            "role": null
          }
        ]
      },
      "final_response": {
        "parts": [
          {
            "text": "Processed reporting_guideline \"PRISMA 2020\". Quality score 92, AI confidence 88. Methodology codes: SYN-04. Thesis stages: SH-01. Draft record created with editorial_status=proposed.",
            "role": null
          }
        ]
      },
      "rubrics": [
        {
          "rubric_id": "r0"
        },
        {
          "rubric_id": "r1"
        },
        {
          "rubric_id": "r2"
        },
        {
          "rubric_id": "r3"
        },
        {
          "rubric_id": "r4"
        }
      ]
    }
  ],
  "conversation_scenario": null,
  "session_input": null,
  "creation_timestamp": 0.0,
  "rubrics": null,
  "final_session_state": {
    "resource_code": "hitl_prisma_fix_001",
    "pipeline_run_id": null
  }
}
