{
  "eval_id": "synthetic_video_methods_009",
  "source": {
    "resource_code": "synthetic_video_methods_009",
    "origin": "synthetic",
    "prompt_versions": {
      "appraisal": "appraisal@1.0.0",
      "classification": "classification@1.0.0",
      "discovery": "discovery@1.0.0",
      "editorial": "editorial@1.0.0",
      "reconciliation": "reconciliation@1.0.0",
      "qc_panel": "qc_panel@1.0.0",
      "arbiter": "arbiter@1.0.0"
    }
  },
  "expected_classification": {
    "resource_type_code": "video",
    "resource_subtype_code": "lecture",
    "methodology_codes": [
      "OBS-03"
    ],
    "skill_codes": [
      "FS-04"
    ],
    "stage_codes": [
      "HI-02"
    ],
    "discipline_codes": [
      "PSYCH"
    ],
    "tags": []
  },
  "conversation": [
    {
      "user_content": {
        "parts": [
          {
            "text": "Curate one video resource titled \"Qualitative methods lecture\". URL: https://example.org/qual. Focus methodologies: OBS-03.",
            "role": null
          }
        ]
      },
      "final_response": {
        "parts": [
          {
            "text": "Processed video \"Qualitative methods lecture\". Quality score 75, AI confidence 70. Methodology codes: OBS-03. Thesis stages: HI-02. Draft record created with editorial_status=proposed.",
            "role": null
          }
        ]
      },
      "rubrics": [
        {
          "rubric_id": "r0"
        },
        {
          "rubric_id": "r1"
        },
        {
          "rubric_id": "r2"
        },
        {
          "rubric_id": "r3"
        },
        {
          "rubric_id": "r4"
        }
      ]
    }
  ],
  "conversation_scenario": null,
  "session_input": null,
  "creation_timestamp": 0.0,
  "rubrics": null,
  "final_session_state": {
    "resource_code": "synthetic_video_methods_009",
    "pipeline_run_id": null
  }
}
